<?xml version="1.0" encoding="UTF-8"?>
<potvrda_o_vakcinaciji xmlns="http://www.ftn.uns.ac.rs/potvrda-o-vakcinaciji"
    xmlns:xsi="http://www.w3.org/2001/XMLSchema-instance"
    xsi:schemaLocation="http://www.ftn.uns.ac.rs/potvrda-o-vakcinaciji potvrda_o_vakcinaciji.xsd"
    potreban_pecat="false" about="http://www.ftn.uns.ac.rs/potvrda_o_vakcinaciji/0123456789">
    <sifra_potvrde>0123456789</sifra_potvrde>
    <datum_izdavanja_potvrde>2021-11-21</datum_izdavanja_potvrde>
    <qr_kod>zdravstvena-ustanova.gov.rs/putanja/ka/dokumentu</qr_kod>
    <licni_podaci about="http://www.ftn.uns.ac.rs/licni-podaci/2001990111111">
        <ime_prezime property="se_zove">Pera Peric</ime_prezime>
        <pol property="ima_pol">M</pol>
        <jmbg property="ima_jmbg">2001990111111</jmbg>
    </licni_podaci>
    <vakcinacije zdravstvena_ustanova="Dom Zdravlja Novi Sad">
        <vakcinacija>
            <naziv_vakcine>Pfizer-BioNTech</naziv_vakcine>
            <datum_davanja>2021-04-10</datum_davanja>
            <broj_serije>14</broj_serije>
        </vakcinacija>
        <vakcinacija>
            <naziv_vakcine>Pfizer-BioNTech</naziv_vakcine>
            <datum_davanja>2021-10-10</datum_davanja>
            <broj_serije>15</broj_serije>
        </vakcinacija>
    </vakcinacije>
</potvrda_o_vakcinaciji>
